{
  "format_version": 1,
  "book_id": "thought-03",
  "chapter_id": "ch-001",
  "character_revision": 1,
  "source": {
    "sha256": "ad0c6554b9425202fbe2f0d8f6c0b315ca792300260f34c4e0974e56a0402cf1",
    "import_sha256": "ad0c6554b9425202fbe2f0d8f6c0b315ca792300260f34c4e0974e56a0402cf1",
    "normalization_version": 1,
    "offset_unit": "utf8_byte"
  },
  "segments": [
    {
      "id": "seg-001",
      "start": 0,
      "end": 27,
      "kind": "thought",
      "attribution": {
        "status": "resolved",
        "evidence_segment_ids": [
          "seg-002"
        ],
        "review_status": "unreviewed",
        "character_id": "lin"
      }
    },
    {
      "id": "seg-002",
      "start": 27,
      "end": 99,
      "kind": "narration"
    }
  ]
}
