{
  "format_version": 1,
  "book_id": "explicit-02",
  "chapter_id": "ch-001",
  "character_revision": 1,
  "source": {
    "sha256": "af99037a885954e0384dd97c7013a1d20c6fdd82c43a847673db4ad30f46c9e4",
    "import_sha256": "af99037a885954e0384dd97c7013a1d20c6fdd82c43a847673db4ad30f46c9e4",
    "normalization_version": 1,
    "offset_unit": "utf8_byte"
  },
  "segments": [
    {
      "id": "seg-001",
      "start": 0,
      "end": 15,
      "kind": "narration"
    },
    {
      "id": "seg-002",
      "start": 15,
      "end": 39,
      "kind": "speech",
      "attribution": {
        "status": "resolved",
        "evidence_segment_ids": [
          "seg-001",
          "seg-003"
        ],
        "review_status": "unreviewed",
        "character_id": "wei"
      }
    },
    {
      "id": "seg-003",
      "start": 39,
      "end": 51,
      "kind": "narration"
    },
    {
      "id": "seg-004",
      "start": 51,
      "end": 75,
      "kind": "speech",
      "attribution": {
        "status": "resolved",
        "evidence_segment_ids": [
          "seg-001",
          "seg-003"
        ],
        "review_status": "unreviewed",
        "character_id": "qin"
      }
    }
  ]
}
