{
  "format_version": 1,
  "book_id": "same_name-01",
  "chapter_id": "ch-001",
  "character_revision": 1,
  "source": {
    "sha256": "4185515b65642146aa2028f85cb91a4f6092de8f197a5062135a2dc147607246",
    "import_sha256": "4185515b65642146aa2028f85cb91a4f6092de8f197a5062135a2dc147607246",
    "normalization_version": 1,
    "offset_unit": "utf8_byte"
  },
  "segments": [
    {
      "id": "seg-001",
      "start": 0,
      "end": 21,
      "kind": "narration"
    },
    {
      "id": "seg-002",
      "start": 21,
      "end": 39,
      "kind": "speech",
      "attribution": {
        "status": "resolved",
        "evidence_segment_ids": [
          "seg-001",
          "seg-003"
        ],
        "review_status": "unreviewed",
        "character_id": "left"
      }
    },
    {
      "id": "seg-003",
      "start": 39,
      "end": 60,
      "kind": "narration"
    },
    {
      "id": "seg-004",
      "start": 60,
      "end": 78,
      "kind": "speech",
      "attribution": {
        "status": "resolved",
        "evidence_segment_ids": [
          "seg-001",
          "seg-003"
        ],
        "review_status": "unreviewed",
        "character_id": "right"
      }
    }
  ]
}
