{
  "format_version": 1,
  "book_id": "explicit-03",
  "chapter_id": "ch-001",
  "character_revision": 1,
  "source": {
    "sha256": "9677d3f725d9efdd6488873f4c264e669e6a3bab38b7cb091dee575472a2e8b2",
    "import_sha256": "9677d3f725d9efdd6488873f4c264e669e6a3bab38b7cb091dee575472a2e8b2",
    "normalization_version": 1,
    "offset_unit": "utf8_byte"
  },
  "segments": [
    {
      "id": "seg-001",
      "start": 0,
      "end": 21,
      "kind": "speech",
      "attribution": {
        "status": "resolved",
        "evidence_segment_ids": [
          "seg-002"
        ],
        "review_status": "unreviewed",
        "character_id": "yan"
      }
    },
    {
      "id": "seg-002",
      "start": 21,
      "end": 45,
      "kind": "narration"
    }
  ]
}
