{
  "format_version": 1,
  "book_id": "continuation-02",
  "chapter_id": "ch-001",
  "character_revision": 1,
  "source": {
    "sha256": "a7e9655d94d07b2e10e4e7ffbc32c5573c0c61197a3c4b3a5b74301d8aa5f7a5",
    "import_sha256": "a7e9655d94d07b2e10e4e7ffbc32c5573c0c61197a3c4b3a5b74301d8aa5f7a5",
    "normalization_version": 1,
    "offset_unit": "utf8_byte"
  },
  "segments": [
    {
      "id": "seg-001",
      "start": 0,
      "end": 21,
      "kind": "narration"
    },
    {
      "id": "seg-002",
      "start": 21,
      "end": 45,
      "kind": "speech",
      "attribution": {
        "status": "resolved",
        "evidence_segment_ids": [
          "seg-001",
          "seg-003"
        ],
        "review_status": "unreviewed",
        "character_id": "cheng"
      }
    },
    {
      "id": "seg-003",
      "start": 45,
      "end": 63,
      "kind": "narration"
    },
    {
      "id": "seg-004",
      "start": 63,
      "end": 87,
      "kind": "speech",
      "attribution": {
        "status": "resolved",
        "evidence_segment_ids": [
          "seg-001",
          "seg-003"
        ],
        "review_status": "unreviewed",
        "character_id": "cheng"
      }
    }
  ]
}
