{
  "format_version": 1,
  "book_id": "anonymous-03",
  "chapter_id": "ch-001",
  "character_revision": 1,
  "source": {
    "sha256": "dbab0a4670302599cb752752a9b2abd74acbaf8c5f458dae4b95aaad80787ef7",
    "import_sha256": "dbab0a4670302599cb752752a9b2abd74acbaf8c5f458dae4b95aaad80787ef7",
    "normalization_version": 1,
    "offset_unit": "utf8_byte"
  },
  "segments": [
    {
      "id": "seg-001",
      "start": 0,
      "end": 18,
      "kind": "speech",
      "attribution": {
        "status": "resolved",
        "evidence_segment_ids": [
          "seg-002"
        ],
        "review_status": "unreviewed",
        "character_id": "porter"
      }
    },
    {
      "id": "seg-002",
      "start": 18,
      "end": 66,
      "kind": "narration"
    },
    {
      "id": "seg-003",
      "start": 66,
      "end": 90,
      "kind": "speech",
      "attribution": {
        "status": "resolved",
        "evidence_segment_ids": [
          "seg-002"
        ],
        "review_status": "unreviewed",
        "character_id": "porter"
      }
    }
  ]
}
