{
  "format_version": 1,
  "book_id": "candidates-04",
  "chapter_id": "ch-001",
  "character_revision": 1,
  "source": {
    "sha256": "5b0031908bcb81a1200a010c11b9715b3da6f7ae217cc69fb63eb27e5a1b5e6b",
    "import_sha256": "5b0031908bcb81a1200a010c11b9715b3da6f7ae217cc69fb63eb27e5a1b5e6b",
    "normalization_version": 1,
    "offset_unit": "utf8_byte"
  },
  "segments": [
    {
      "id": "seg-001",
      "start": 0,
      "end": 123,
      "kind": "narration"
    },
    {
      "id": "seg-002",
      "start": 123,
      "end": 150,
      "kind": "speech",
      "attribution": {
        "status": "ambiguous",
        "evidence_segment_ids": [
          "seg-001"
        ],
        "review_status": "unreviewed",
        "candidate_ids": [
          "worker",
          "cook"
        ]
      }
    }
  ]
}
