{
  "format_version": 1,
  "book_id": "explicit-01",
  "chapter_id": "ch-001",
  "character_revision": 1,
  "source": {
    "sha256": "ca19fb507aec2031bde22a08ba6fb6f91f177f51a89f35b40f174f2e9d25ece2",
    "import_sha256": "ca19fb507aec2031bde22a08ba6fb6f91f177f51a89f35b40f174f2e9d25ece2",
    "normalization_version": 1,
    "offset_unit": "utf8_byte"
  },
  "segments": [
    {
      "id": "seg-001",
      "start": 0,
      "end": 12,
      "kind": "narration"
    },
    {
      "id": "seg-002",
      "start": 12,
      "end": 36,
      "kind": "speech",
      "attribution": {
        "status": "resolved",
        "evidence_segment_ids": [
          "seg-001"
        ],
        "review_status": "unreviewed",
        "character_id": "su"
      }
    }
  ]
}
