{
  "format_version": 1,
  "book_id": "same_name-04",
  "chapter_id": "ch-001",
  "character_revision": 1,
  "source": {
    "sha256": "c8b45fd8321a9d6cd14bd8f3e2398c0d8fe90d6586a9df19eedca970e7db0ccb",
    "import_sha256": "c8b45fd8321a9d6cd14bd8f3e2398c0d8fe90d6586a9df19eedca970e7db0ccb",
    "normalization_version": 1,
    "offset_unit": "utf8_byte"
  },
  "segments": [
    {
      "id": "seg-001",
      "start": 0,
      "end": 105,
      "kind": "narration"
    },
    {
      "id": "seg-002",
      "start": 105,
      "end": 126,
      "kind": "speech",
      "attribution": {
        "status": "ambiguous",
        "evidence_segment_ids": [
          "seg-001"
        ],
        "review_status": "unreviewed",
        "candidate_ids": [
          "tian1",
          "tian2"
        ]
      }
    }
  ]
}
